title,upload_time,uploader,view_count
Sen. Joe Biden on Shalom TV,2007-04-04T21:47:31Z,UCytSoHh3dD8T9_bKrEFdZUg,121843
Barack Obama: His Story,2012-05-04T21:10:12Z,UCE2qnvTkp3-2lkoQqXZK1UQ, 
Class Act,2013-10-12T20:05:35Z,UCxb8c7i05IQFixOq_h4bE1Q, 
Joe Rogan: Rocky Mountain High,2014-11-04T01:17:22Z,UClZ5Usl-QulPjv-cgAO3QeQ, 
The 11th Hour,2015-05-01T20:33:27Z,UCr8qH9WclPwSy86S-eYNE5g, 
Ready,2015-11-09T22:50:48Z,UCqqUPU-qLCap5eVqGYmhEew, 
Uncivil War: Battle for America,2017-06-28T01:37:37Z,UC9w6t2bdmrmV295l2nA2Uug, 
Blood Child,2018-09-13T08:40:59Z,UCFAnqTOB9fD60OL6lJMwIzw, 
Frank Biden of The Berman Law Group,2019-02-14T18:23:42Z,UCMi2e7xuQH2nRigNY2lEwqA,28921
Kamala Harris attacks Joe Biden&#39;s record on race in Democratic debate,2019-06-28T07:54:22Z,UCIRYBXDze5krPDzAEOxFGVA,1035041
"MSNBC’s Kornacki: Biden “In Particular Trouble” In New Poll, “The Floor Pretty Much Falling Out”",2019-08-26T18:48:18Z,UCvQ2kejN6UkrEVhE5oiYwBw,7294
Joe Biden bragging and acknowledging quid pro quo corruption including his son and Ukraine,2019-09-25T06:43:11Z,UCA-WW5lh7U96NGw6v9MJ7HA,42464
Joe Biden speaking in an arena in Iowa gets confused where the camera is and keeps talking to a scre,2019-11-02T15:55:11Z,UCwZaqHfNdI1VAs4Ixjt6AeQ,13398
MSNBC’s O&#39;Donnell: Biden Gaffe Is A “Gaffe Unlike Any Other I’ve Seen In A Debate Performance”,2019-11-21T04:52:36Z,UCvQ2kejN6UkrEVhE5oiYwBw,3827
Joe Biden Lashes Out At Voter After He Calls Biden Out On Ukraine: “You’re A Damn Liar&quot;,2019-12-05T18:25:47Z,UCvQ2kejN6UkrEVhE5oiYwBw,21725
Joe Biden: “We Don’t Need Standing Armies”,2020-01-22T02:32:53Z,UCvQ2kejN6UkrEVhE5oiYwBw,7941
CNN’s King: Joe Biden’s Bad Iowa Results A Disappointment For Him,2020-02-04T22:45:57Z,UCvQ2kejN6UkrEVhE5oiYwBw,2663
ABC NEWS SPECIAL REPORT: Pres.-elect Biden and VP-elect Harris deliver remarks on economy,2020-02-12T00:32:37Z,UCBi2mrWuNuyYy4gbM6fU18Q,129276181
"Biden’s Resurgence, Obama’s Quiet Hand and the Impact of Coronavirus on Europe",2020-03-11T13:14:49Z,UCB7z0vqLeb9fxfxQBqwUK7g,2087
ABC News Report On Biden the Liar,2020-03-17T04:07:07Z,UCvlvVrxlIh6JbuAVhL46clQ,9042
"Biden, Trump Wrong About WHO Coronavirus Tests – FactCheck.org",2020-03-24T20:13:05Z,UCc_VNUgjPdpaQdoHRVcCRYQ,586
Joe Biden: Coronavirus Crisis Provides An “Opportunity” To Push Green New Deal,2020-03-25T17:52:40Z,UCvQ2kejN6UkrEVhE5oiYwBw,15035
MSNBC Graphic Fact Checks Biden Live As He Gets Date He Wrote Article Wrong,2020-04-01T14:30:54Z,UCvQ2kejN6UkrEVhE5oiYwBw,2815
Joe Biden getting DESTROYED in a President Trump campaign ad. &quot; I&#39;m not going nuts&quot; ...Joe Biden,2020-04-09T22:55:45Z,UC-AWBdp92O_3ZQogfxBRHkA,40538
"Obama, Bernie, Biden, Trudeau &amp; Trump as The Usual Suspects",2020-04-13T03:39:16Z,UCnTzqM0nHdI5vElXZuPzNNg,1156
"Biden Defends Kavanaugh Comments, Says Burden On The Accused",2020-05-01T12:47:17Z,UCvQ2kejN6UkrEVhE5oiYwBw,3364
Former Vice President Joe Biden addresses George Floyd protests from Philadelphia - 6/2/2020,2020-06-02T14:35:13Z,UCrp_UI8XtuYfpiqluWLD7Lw,138759
Joe Biden - Healing the Country and Acknowledging Weaknesses | The Daily Social Distancing Show,2020-06-11T12:58:21Z,UCwWhs_6x42TyRM4Wstoq8HA,1250943
Martha gets heated with Symone Sanders over Biden&#39;s 5 decades-long career,2020-07-14T23:34:50Z,UCXIJgqnII2ZOINSWNOGFThA,1299608
Hillary Clinton: Fighting for Us,2020-07-21T04:00:05Z,UCCCvidX5v5vVYMXN7PUlapw, 
A Socially Distanced Conversation: President Barack Obama and Vice President Joe Biden,2020-07-23T14:00:50Z,UCWNpXitY8eJ-ku6M-v25MKw,1465654
A Socially Distanced Conversation: President Barack Obama and Vice President Joe Biden,2020-07-23T14:00:50Z,UCWNpXitY8eJ-ku6M-v25MKw,1465654
Life Of Biden,2020-07-24T04:43:09Z,UCnog-i5PPnMlUwJ3m32Eg_w,911
In his latest appearance Joe Biden ‘forgets where he is then laughs it off’,2020-07-30T08:14:13Z,UCO0akufu9MOzyz3nvGIXAAw,2302274
The Armor of Light,2020-08-04T04:00:07Z,UCG0jajzQ7skeD6phjbFgACw, 
Joe Biden: “There Will Not Be Another Foot Of Wall Constructed In My Administration”,2020-08-05T17:18:44Z,UCvQ2kejN6UkrEVhE5oiYwBw,1517
Joe Biden Works Numbers,2020-08-11T14:46:11Z,UCrxHWwccL9Lj4yVGy8zoMDg,7023
Joe Biden and Kamala Harris address the nation as running mates — 8/12/2020,2020-08-12T21:37:10Z,UCrp_UI8XtuYfpiqluWLD7Lw,180089
Joe Biden and Kamala Harris address the nation as running mates — 8/12/2020,2020-08-12T21:37:10Z,UCrp_UI8XtuYfpiqluWLD7Lw,180089
"Weekly Takes-11A, International News, News about USA, Trump vs Biden, One fun fact about NYC",2020-08-15T20:33:47Z,UC-vOsUPHBEvsRrhwL6GO9pQ,1800
Joe Biden Cumhurbaşkanı Erdoğan&#39;ı hedef aldı &quot;darbe ile değil seçimle yenilecek&quot; dedi,2020-08-16T08:45:00Z,UCV6zcRug6Hqp1UX_FdyUeBg,216558
The Joe Biden They Are Hiding From You,2020-08-18T04:16:30Z,UCAql2DyGU2un1Ei2nMYsqOA,19705753
Meet Dr. Jill Biden,2020-08-18T17:52:53Z,UCZ6cvgUg_pL-HdsV8yFig1Q,261
Watch Joe Biden&#39;s Full Speech At The 2020 DNC | NBC News,2020-08-21T04:09:21Z,UCeY0bbntWzzVIaj2z3QigXg,1588340
Rick Tyler says he&#39;s voting for Biden — and his party is heading for a &quot;wipeout&quot;,2020-08-22T14:05:07Z,UCR-YSMVJU45jgAoqndj7MoA,2688
Biden Staffers Filter What Questions Biden Is Allowed To Take,2020-09-02T17:46:36Z,UCvQ2kejN6UkrEVhE5oiYwBw,15215
epic joe biden spartan maniacy remic,2020-09-02T17:50:42Z,UCEuoLhz5zPfDLjYqx0Eht1g,1434
The Joe Biden Meme the media don’t want you to see,2020-09-03T22:24:41Z,UCA17ZIFYy3WiiSpLFhEQ9tA,352802
Como Si Fuera La Primera Vez (50 First Dates),2020-09-08T04:02:03Z,UC3JP43Gti2vCyREqPcXTwLA, 
See Biden&#39;s reaction to Trump revealing secret weapons system,2020-09-10T22:26:08Z,UCupvZG-5ko_eiXAupbDfxWw,1743321
Joe Biden &#39;sounding increasingly vague and confused&#39;,2020-09-14T10:32:33Z,UCO0akufu9MOzyz3nvGIXAAw,956373
Joe Biden jams Fuck a Dog by blink-182,2020-09-16T16:26:11Z,UCsjKBlGr8otVJVvumO4xYdA,860
Joe Biden speaks about the  public health need to trust scientists and not Donald Trump,2020-09-16T20:34:34Z,UC1Z1i5ClfrJhyu9z1hlmDkQ,753
Joe Biden Ringtone + Download,2020-09-17T18:28:32Z,UCHxlY1Gt5lpsq-dGNCGbH7g,573
Fleet Master Chief Raymond Kemp is voting for Joe Biden because he is questioning Trump&#39;s integrity.,2020-09-18T16:40:46Z,UCebm6qea5gpDU6ucJqeJvvw,691
Biden Admits He Is Hiding His Supreme Court List From The American People,2020-09-22T02:58:18Z,UCvQ2kejN6UkrEVhE5oiYwBw,28577
Anthony Zenkus on Joe Biden with In Bidens Boundaries,2020-09-22T23:00:07Z,UCBervKMiCOzFv22EAZoDu5A,3647
Joe Biden Endorses Sen. Gary Peters,2020-09-26T02:25:15Z,UCXVcNr1VztNcc0YVTJAmpKw,106
Kangana Ranaut reacts to Donald Trump&#39;s take against Joe Biden,2020-09-28T06:28:34Z,UC1xMoLlrv0DJ3hcBo914a2Q,134
Trump and Biden face off in chaotic first 2020 presidential debate | FULL DEBATE,2020-09-30T03:51:16Z,UC8p1vwvWtl6T73JiExfWs1g,10283987
Full Presidential Debate: President Trump and Joe Biden | WSJ,2020-09-30T04:29:16Z,UCK7tptUDHh-RYDsdxO1-5QQ,4832459
DONALD TRUMP BEATING JOE BIDEN? 1ST DEBATE (ROUND 1) INTERRUPTION WINNER!,2020-09-30T05:51:25Z,UCHvWY3PTPR8M_gSTQi7lbhA,937
Los momentazos del debate de Trump y Biden,2020-09-30T06:20:44Z,UCTJXx9onKH6g4cWHS9pLqsQ,737055
Joe Biden 2020 Debate - Number One Number Three,2020-09-30T12:54:23Z,UC8OltxLYcT4vaOjizh5uqPw,415
Trump Vs Biden: Những khoảnh khắc khiến truyền thông &quot;dậy sóng&quot; | VTC Now,2020-09-30T15:57:29Z,UCL9-pEHNBs3N4r2bMoXdLJA,345316
Bolsonaro responde Joe Biden e diz não aceitar suborno,2020-09-30T17:01:37Z,UCVFbXI6Gu8U2f9Gjtxw4A-Q,114977
O Grande Debate: Bolsonaro fez certo ao responder a Joe Biden?,2020-10-01T01:01:25Z,UCvdwhh_fDyWccR42-rReZLw,72642
Climate Activists Believe Biden Open To Saving The World. Alex Kaufman Joins,2020-10-01T18:00:10Z,UC7yoXZ7c8ZZAimgcqHBtHoQ,441
Former Republican: Joe Biden Is The Only Candidate Able To Make America COVID-Free Again.,2020-10-02T20:45:02Z,UC03-Q9vq-JyiStTnqasADVg,15493
"Quick Hits: Trump, First Lady test positive for COVID-19, Biden negative",2020-10-02T21:23:14Z,UCjDOSjicDZCsPjChQM_fo_Q,186
"Political Machine 2020: Joe Biden vs. Donald Trump, 10-3-2020",2020-10-04T15:04:48Z,UCZ32kX6XL9SAqrnY_FOkBXg,76
Joe Biden Town Hall Hosted By Lester Holt | NBC News NOW,2020-10-06T01:06:23Z,UCeY0bbntWzzVIaj2z3QigXg,1200260
WATCH LIVE: NBC News&#39; Lester Holt hosts town hall with Joe Biden — 10/5/2020,2020-10-06T01:36:39Z,UCrp_UI8XtuYfpiqluWLD7Lw,301916
Created Equal: Clarence Thomas In His Own Words,2020-10-06T04:02:02Z,UCOPAePvzqLbB89WAjo2fDJA, 
Joe Biden delivers remarks from Gettysburg calling on Americans to come together | FULL,2020-10-06T21:01:09Z,UCPWXiRWZ29zrxPFIQT7eHSA,74926
"VP Pence: Trump Gave Families “$2,000 In Savings…Biden’s Going To Raise Your Taxes”",2020-10-08T01:47:39Z,UCvQ2kejN6UkrEVhE5oiYwBw,3033
Mass Hysteria,2020-10-08T18:16:32Z,UC5lJrbLK9ZNYpPy1LcxhBmQ, 
Trump Card,2020-10-09T04:02:04Z,UCs5p_Sm5VFaTsVoojisBDKQ, 
O que revelam os &#39;documentos secretos&#39; da ditadura levados por Biden ao Brasil,2020-10-10T02:19:00Z,UCthbIFAxbXTTQEC7EcQvP1Q,356786
Joe Biden&#39;s Most Awkward Gaffes Of All Time (Part 3),2020-10-12T09:33:54Z,UCME81PohuzT1JMCsEtvsD2w,687912
Hannity: Biden commits more gaffes on the campaign trail,2020-10-13T02:19:36Z,UCXIJgqnII2ZOINSWNOGFThA,1196625
Totally Under Control,2020-10-13T04:02:05Z,UC966YRvCKLuJ5hktCoLRx1g, 
You&#39;ve Been Trumped,2020-10-14T11:51:49Z,UCsIhV_1MvkVMMdIhMcj88eA, 
"Biden’s TOO TIRED to Campaign, so Obama Jumps In To Save Him From Trump!",2020-10-15T00:56:30Z,UCXu3Qcw018ZNU0qJ3hVn9mQ,58979
Joe Biden answer how he would have handled the pandemic l ABC News Town Hall,2020-10-16T00:45:08Z,UCBi2mrWuNuyYy4gbM6fU18Q,272197
Joe Biden pressed on why Black voters should choose him l ABC News Town Hall,2020-10-16T01:00:00Z,UCBi2mrWuNuyYy4gbM6fU18Q,477544
Joe Biden pressed on why Black voters should choose him l ABC News Town Hall,2020-10-16T01:00:00Z,UCBi2mrWuNuyYy4gbM6fU18Q,477544
Twitter blocks NY post Hunter Biden Article,2020-10-16T01:01:37Z,UC-agfgA5Ia5Z7aCUQy8b80A,114
Não querem que você saiba sobre denúncias envolvendo o filho de Biden,2020-10-16T01:11:55Z,UCzjtGnD7qqeaHW3nvDVrjQA,105791
Watch ABC News Joe Biden Town Hall in Philadelphia Moderated by George Stephanopoulos,2020-10-16T03:13:51Z,UCBi2mrWuNuyYy4gbM6fU18Q,7263981
Highlights From Trump And Biden’s Dueling Town Hall Events | NBC News,2020-10-16T04:45:29Z,UCeY0bbntWzzVIaj2z3QigXg,1928088
Face e Twitter restrigem matéria contra Biden,2020-10-16T14:30:27Z,UC-wcdrzucnlKGBjyEUaEWaQ,41231
&quot;Magic To Do&quot; Arts For Biden Harris Nevada,2020-10-17T19:00:01Z,UC2nRw5qJZway52x0CvtX6Nw,329
EXCLUSIVE: Joe Biden&#39;s son emailed shop owner about hard drive to &#39;get it back&#39;: Former Trump chief,2020-10-18T08:04:32Z,UCO0akufu9MOzyz3nvGIXAAw,4888112
The Biden family ‘is a criminal enterprise’,2020-10-19T00:56:34Z,UCO0akufu9MOzyz3nvGIXAAw,559212
"Giuliani: Hunter Biden Emails, Photos &#39;Will Shock the Hell Out of You&#39;",2020-10-19T14:46:17Z,UCz4x3Z7Joh7Ama85cFVRtjQ,522488
Joe Biden VS Donald Trump Through The Years | Joe Biden For President 2020,2020-10-19T17:00:03Z,UCWNpXitY8eJ-ku6M-v25MKw,294226
Joe Biden VS Donald Trump Through The Years | Joe Biden For President 2020,2020-10-19T17:00:03Z,UCWNpXitY8eJ-ku6M-v25MKw,294226
"Hunter Biden&#39;s jailed former business partner flipped &amp; leaked 26,000 emails",2020-10-19T17:35:53Z,UCvqtzdcURSqNjY9RQEK4XmQ,800683
Now We Know Why Joe Biden Got So Angry,2020-10-20T04:00:06Z,UCAql2DyGU2un1Ei2nMYsqOA,19467341
TIMELINE: Trump&#39;s Own Words vs. Biden&#39;s,2020-10-20T12:18:41Z,UCwNJt9PYyN1uyw2XhNIQMMA,80987
TIMELINE: Trump&#39;s Own Words vs. Biden&#39;s,2020-10-20T12:18:41Z,UCwNJt9PYyN1uyw2XhNIQMMA,80987
Saagar Enjeti DISMANTLES All The Medias LIES About The Hunter Biden Story,2020-10-20T14:30:00Z,UCPWXiRWZ29zrxPFIQT7eHSA,374373
Donald Trump vs. Joe Biden : ce que les médias ne disent (presque) pas,2020-10-20T18:42:40Z,UCPD_ARnv3_TGGnBxzLr9bWw,68960
Donald Trump vs. Joe Biden : ce que les médias ne disent (presque) pas,2020-10-20T18:42:40Z,UCPD_ARnv3_TGGnBxzLr9bWw,68960
Tony Bobulinski held presser claiming Joe Biden knew about Hunter&#39;s business deals,2020-10-22T23:27:53Z,UCXIJgqnII2ZOINSWNOGFThA,2126636
Trump o Biden: Último debate presidencial | Noticias Telemundo,2020-10-23T02:47:13Z,UCRwA1NUcUnwsly35ikGhp0A,4077172
Second 2020 Presidential Debate between Donald Trump and Joe Biden,2020-10-23T02:49:33Z,UCb--64Gl51jIEVE-GLDAVTg,16206087
2020 Election Results Live: Joe Biden Will Become 46th President of the United States l ABC News,2020-10-23T23:09:12Z,UCBi2mrWuNuyYy4gbM6fU18Q,83552793
Which Battleground States Do Trump And Biden Need To Win The Presidency? | TODAY,2020-10-24T15:07:05Z,UChDKyKQ59fYz3JO2fl0Z6sg,737673
"Black Eyed Peas y Jennifer Hudson, en el video clip de apoyo a Joe Biden",2020-10-24T17:18:57Z,UCTYpmn1630BfqLH2jmVYzAg,1120
Donald Trump vs Joe Biden. Epic Rap Battles Of History,2020-10-24T19:00:00Z,UCMu5gPmKp5av0QCAajKTMhw,11931210
Joe Biden brags about having “the most extensive and inclusive VOTER FRAUD organization” in history.,2020-10-24T22:50:02Z,UCAql2DyGU2un1Ei2nMYsqOA,1834954
Joe Biden brags about having “the most extensive and inclusive VOTER FRAUD organization” in history.,2020-10-24T22:50:02Z,UCAql2DyGU2un1Ei2nMYsqOA,1834954
Joe Biden: The 60 Minutes 2020 Election Interview,2020-10-26T15:10:17Z,UCsN32BtMd0IoByjJRNF12cw,4901276
MUST WATCH: President Trump plays a DEVASTATING video for Joe Biden in #Pennsylvania!,2020-10-26T15:59:10Z,UCAql2DyGU2un1Ei2nMYsqOA,2235793
"Tucker exclusive: Tony Bobulinski, ex-Hunter Biden associate, speaks out on Joe Biden",2020-10-28T01:40:27Z,UCXIJgqnII2ZOINSWNOGFThA,4831818
Live: 2020 Election Results Map For Trump Vs. Biden | NBC News,2020-10-28T15:50:08Z,UCeY0bbntWzzVIaj2z3QigXg,34859103
Ted Cruz grills Twitter CEO Jack Dorsey for &#39;censoring&#39; Hunter Biden story,2020-10-28T17:10:20Z,UCXIJgqnII2ZOINSWNOGFThA,2944266
The New York Post vs. The Biden Crime Family | Larry Elder,2020-10-28T18:18:18Z,UCZmkvHLQu76lYbW1w9FoGzQ,199911
¿Quién es Joe Biden? Biografía de candidato que busca derrocar a Trump en las elecciones de EUA,2020-10-28T18:31:54Z,UC7E9Dj_lmrJdDrH2Bg7rNqQ,8579
Media Refuses To Report Hunter Biden Story For Dumbest Reason Ever,2020-10-28T20:00:03Z,UCldfgbzNILYZA4dmDt4Cd6A,94158
Trump x Biden: o que eles propõem para os EUA e o mundo?,2020-10-28T22:30:38Z,UCthbIFAxbXTTQEC7EcQvP1Q,276555
Tucker: Hunter Biden documents suddenly vanish,2020-10-29T00:53:36Z,UCXIJgqnII2ZOINSWNOGFThA,2067112
Trump ou Biden? A escolha dos brasileiros que votam nos EUA,2020-10-30T00:34:09Z,UCthbIFAxbXTTQEC7EcQvP1Q,41505
Tucker: Hunter Biden documents suddenly reappear,2020-10-30T00:43:06Z,UCXIJgqnII2ZOINSWNOGFThA,2021842
US Election: Rival Trump and Biden supporters clash at Florida rally,2020-10-30T09:52:23Z,UCoMdktPbSTixAyNGwb-UYkQ,513048
Los votos del Colegio Electoral asegurados de Trump y Biden | Noticias con Ciro Gómez Leyva,2020-10-31T05:23:39Z,UCcHtke0raf8vNYLM1Hbq3Jw,46581
Biden And Obama Campaign In Michigan | NBC News,2020-10-31T23:26:57Z,UCeY0bbntWzzVIaj2z3QigXg,925902
Biden Halloween Cold Open - SNL,2020-11-01T06:46:42Z,UCqFzWxSCi39LnW1JKFR3efg,5215977
Young Billy Young,2020-11-01T07:00:05Z,UCuVPpxrm2VAgpH3Ktln4HXg, 
"☑️ JOE BIDEN: el RESUMEN definitivo  | Propuestas, datos, su historia, su pasado...",2020-11-01T09:03:57Z,UCPH3Oz99Y_jrVBCQMjQZNSg,605802
"Trump plays BRUTAL compilation video of Kamala Harris, Joe Biden",2020-11-01T13:30:06Z,UCPWXiRWZ29zrxPFIQT7eHSA,237977
"H-2 Pilpres AS, Joe Biden Berkampanye bersama Barrack Obama",2020-11-02T02:14:54Z,UC5BMIWZe9isJXLZZWPWvBlg,766997
Joe Biden &amp; Lady Gaga + Kamala Harris &amp; John Legend | Election Night 2020 Rally in Pennsylvania,2020-11-03T02:47:50Z,UCWNpXitY8eJ-ku6M-v25MKw,612295
Joe Biden &amp; Lady Gaga + Kamala Harris &amp; John Legend | Election Night 2020 Rally in Pennsylvania,2020-11-03T02:47:50Z,UCWNpXitY8eJ-ku6M-v25MKw,612295
Biden &amp; Trump Make Drastically Different Final Pitches to Voters | The Daily Social Distancing Show,2020-11-03T02:56:00Z,UCwWhs_6x42TyRM4Wstoq8HA,1570986
Joe Biden&#39;s gaffes and funniest moments of the 2020 campaign,2020-11-03T17:00:02Z,UCIzXayRP7-P0ANpq-nD-h5g,245863
Jalife - Joe Biden Contra México,2020-11-03T17:24:13Z,UCrDRyUWlxGgyZuADemVAW4Q,1032164
President Barack Obama Facetimes Joe Biden Voters | Election Day | Joe Biden For President 2020,2020-11-03T19:10:56Z,UCWNpXitY8eJ-ku6M-v25MKw,241543
Elecciones en EEUU: ¿Quién es Joe Biden? | Semana Noticias,2020-11-03T19:57:46Z,UC4oQAvXFuNlKivYjUynQKTA,12390
ELEIÇÕES EUA: JOE BIDEN é eleito Presidente. Por que TRUMP quer contestar o resultado??,2020-11-03T20:33:28Z,UCOCXti8bC9uE6ws22yBIZLA,434043
ELEIÇÕES EUA: JOE BIDEN é eleito Presidente. Por que TRUMP quer contestar o resultado??,2020-11-03T20:33:28Z,UCOCXti8bC9uE6ws22yBIZLA,434043
Muôn kiểu ủng hộ Trump - Biden của người Mỹ | VTV24,2020-11-04T04:28:34Z,UCabsTV34JwALXKGMqHpvUiA,527320
¿Cómo puede afectar el triunfo de Joe Biden la relación México-EU?,2020-11-04T05:37:02Z,UCFxHplbcoJK9m70c4VyTIxg,17534
"Joe Biden Speaks LIVE on Election Night from Wilmington, Delaware",2020-11-04T05:47:53Z,UCWNpXitY8eJ-ku6M-v25MKw,212297
AMÉRICA DECIDE - Início da apuração da eleição entre Trump e Biden,2020-11-04T06:18:21Z,UCvdwhh_fDyWccR42-rReZLw,1336404
"Jika Joe Biden Menang, Ini Proyeksi Nasib Indonesia di Bawah &#39;Cengkeraman&#39; AS",2020-11-04T07:49:35Z,UCPvi3d3MAILSVKRIU_1Mnkg,323041
"Election Night 2020: Coverage of Trump, Biden and key races | USA TODAY",2020-11-04T08:58:02Z,UCP6HGa63sBC7-KHtkme-p-g,4308305
Joe Biden Koyu Bir &#39;Rum&#39; Yanlısı,2020-11-04T10:00:09Z,UCzgrZ-CndOoylh2_e72nSBQ,31904
Ini Cara Barack Obama Bantu Joe Biden Kampanye Menangi Pilpres AS,2020-11-04T12:30:42Z,UC5BMIWZe9isJXLZZWPWvBlg,462840
"DPR: Jika Joe Biden Menang, Indonesia Alami Kemunduran",2020-11-04T14:12:34Z,UC5BMIWZe9isJXLZZWPWvBlg,777474
Joe Biden Speaks LIVE about the 2020 Election | Joe Biden For President 2020,2020-11-04T21:19:01Z,UCWNpXitY8eJ-ku6M-v25MKw,379693
Joe Biden: &#39;We believe we will be the winners&#39;,2020-11-04T21:35:59Z,UCrp_UI8XtuYfpiqluWLD7Lw,153051
Election 2020: Biden campaign holds a news conference as America&#39;s votes are counted,2020-11-04T21:43:11Z,UCEAZeUIeJs0IjQiqTCdVSIg,54390
A vitória de Biden e o Brasil. Entrevista com Celso Amorim,2020-11-04T22:43:20Z,UCPYIYR0J8ppEJVtR1weLnBw,19194
Jair Bolsonaro alerta para o perigo da vitória de Biden,2020-11-05T01:27:02Z,UCzjtGnD7qqeaHW3nvDVrjQA,710954
"As Biden Nears Victory, Trump Tries to Steal the Election: A Closer Look",2020-11-05T02:38:19Z,UCVTyTA7-g9nopHeHbeuvpRA,3200930
Detik-Detik Akhir Pertarungan Trump Vs Biden,2020-11-05T03:30:01Z,UCGN9JsnkvK05v2lnTI_-uGA,2001406
"WATCH: Election results for Trump, Biden and key swing state races | USA TODAY",2020-11-05T09:31:23Z,UCP6HGa63sBC7-KHtkme-p-g,20702190
"WATCH: Election results for Trump, Biden and key swing state races | USA TODAY",2020-11-05T09:31:23Z,UCP6HGa63sBC7-KHtkme-p-g,20702190
How Trump Reacted to Fox News Calling Arizona for Biden,2020-11-05T23:00:46Z,UC9k-yiEpRHMNVOnOi_aQK8w,553562
Watch Joe Biden&#39;s speech as votes are counted,2020-11-05T23:04:55Z,UCupvZG-5ko_eiXAupbDfxWw,660127
Tiểu sử ông JOE BIDEN - TỔNG THỐNG THỨ 46 CỦA NƯỚC MỸ,2020-11-05T23:40:00Z,UCrLDWFzb09-afEL2Wfdxktw,28932
Swing states still undecided in race between Trump and Biden | USA TODAY,2020-11-06T01:31:04Z,UCP6HGa63sBC7-KHtkme-p-g,5693524
"Biden Unggul Sementara, Trump Meradang",2020-11-06T03:52:42Z,UCzl0OrB3-ehunyotIQvK77A,172125
Trump Supporters Upset About Fox News Calling Arizona for Biden | The Tonight Show,2020-11-06T04:36:56Z,UC8-Th83bH_thdKZDJCrn88g,1477333
"Menanti Hasil Pilpres AS, Donald Trump atau Joe Biden?",2020-11-06T08:27:00Z,UC5BMIWZe9isJXLZZWPWvBlg,356053
DNA: Joe Biden के US President बनने का India के लिए क्या मतलब है? | Sudhir Chaudhary | Analysis,2020-11-06T18:06:37Z,UCIvaYmXn910QMdemBG3v1pQ,1562642
"Vice President Joe Biden Speaks from Wilmington, Delaware LIVE",2020-11-07T04:00:08Z,UCWNpXitY8eJ-ku6M-v25MKw,774724
"Democratic presidential nominee Joe Biden speaks in Wilmington, Del. — 11/6/2020",2020-11-07T04:00:16Z,UCrp_UI8XtuYfpiqluWLD7Lw,226466
"Democratic presidential nominee Joe Biden speaks in Wilmington, Del. — 11/6/2020",2020-11-07T04:00:16Z,UCrp_UI8XtuYfpiqluWLD7Lw,226466
Joe Biden makes a statement as election 2020 vote count continues,2020-11-07T04:01:33Z,UCEAZeUIeJs0IjQiqTCdVSIg,48497
"LIVE: Biden and Harris Deliver Prime Time Speech in Wilmington, Delaware",2020-11-07T04:16:08Z,UChirEOpgFCupRAk5etXqPaA,943948
Joe Biden addresses nation as votes continue to be tallied,2020-11-07T05:03:31Z,UCupvZG-5ko_eiXAupbDfxWw,1432601
Joe Biden addresses nation as votes continue to be tallied,2020-11-07T05:03:31Z,UCupvZG-5ko_eiXAupbDfxWw,1432601
SELAMAT - PRESIDEN JOE BIDEN TERPILIH!! DPR AS Putuskan - Donald Trump Terlantar Ditinggal Timsesnya,2020-11-07T06:07:58Z,UC3qf1fkcCnm3CDqAeTTkQYg,575258
Pennsylvania 2020 Election: Why This Ex-Trump Voter Backs Biden,2020-11-07T11:59:49Z,UC_Lnb8ZHqqgLbp-7hltuT9w,222544
URGENTE: JOE BIDEN É O NOVO PRESIDENTE DOS EUA | O QUE FAZER COM SEUS INVESTIMENTOS?,2020-11-07T16:31:47Z,UCT4nDeU5pv1XIGySbSK-GgA,526061
URGENTE: JOE BIDEN É O NOVO PRESIDENTE DOS EUA | O QUE FAZER COM SEUS INVESTIMENTOS?,2020-11-07T16:31:47Z,UCT4nDeU5pv1XIGySbSK-GgA,526061
Dit is de nieuwe president van de Verenigde Staten: Joe Biden,2020-11-07T16:39:01Z,UCv4NUJ5BGSpJz_leIfayDzQ,29374
Joe Biden and Kamala Harris Have Won the Presidential Election | NowThis,2020-11-07T16:45:22Z,UCn4sPeUomNGIr26bElVdDYg,922921
Joe Biden wird US-Präsident! Und jetzt? | Analyse,2020-11-07T16:55:51Z,UCZHpIFMfoJJ_1QxNGLJTzyA,795539
CNN&#39;s Van Jones brought to tears as Joe Biden wins US election,2020-11-07T17:02:29Z,UCIRYBXDze5krPDzAEOxFGVA,3931473
Joe Biden ile dünyayı neler bekliyor? | &quot;Türkiye&#39;ye çağrı yapmaya başladı bile&quot; - DW Türkçe,2020-11-07T17:05:26Z,UCpi_jv70749NkAmkdugyiPQ,237239
Joe Biden wordt de nieuwe president van Amerika,2020-11-07T17:11:54Z,UC-bbHiTZGWKbsCjpzUfrk6Q,290131
LIVE: Joe Biden nieuwe president VS,2020-11-07T17:25:08Z,UC5xziMuoFAOpX9mwUVhe2Jw,40125
Joe Biden is the next president of the United States several networks say,2020-11-07T17:26:07Z,UCxPPgRYHH1NSp2Ya_ROiXxw,3062
Os recordes da eleição que deu vitória a Joe Biden nos EUA,2020-11-07T17:29:07Z,UCthbIFAxbXTTQEC7EcQvP1Q,150791
ABD&#39;nin Yeni Başkanı Belli Oldu! Yeni Başkan Joe Biden,2020-11-07T17:37:31Z,UCtc-a9ZUIg0_5HpsPxEO7Qg,28869
"Conheça Joe Biden, o novo presidente dos Estados Unidos",2020-11-07T17:43:55Z,UCuiLR4p6wQ3xLEm15pEn1Xw,96808
Biden: ‘I Am Honored And Humbled’ | NBC News,2020-11-07T17:44:46Z,UCeY0bbntWzzVIaj2z3QigXg,386182
Joe Biden wins US election to become 46th President - BBC News,2020-11-07T18:06:26Z,UC16niRr50-MSBwiO3YDb3RA,858709
Laporan VOA untuk Metro TV: Joe Biden Presiden Terpilih Amerika Serikat,2020-11-07T18:08:26Z,UCHayGDQxvhjgcvqgKDCPhsQ,116109
Joe Biden’s path to victory: five days in five minutes,2020-11-07T18:24:19Z,UCIRYBXDze5krPDzAEOxFGVA,217777
Triunfo de Joe Biden y Kamala Harris | Masivas celebraciones en Estados Unidos,2020-11-07T18:38:47Z,UCkccyEbqhhM3uKOI6Shm-4Q,18876
&#39;Don&#39;t be ridiculous&#39;: Rudy Giuliani learns about Biden win from reporters,2020-11-07T19:11:31Z,UCIRYBXDze5krPDzAEOxFGVA,2235504
"Après l&#39;élection de Joe Biden, Van Jones ne peut retenir son émotion sur CNN",2020-11-07T19:19:05Z,UC9GGzAhhvhJO1hL10-BcgNA,251696
ZDF spezial: &quot;Sieg für Biden – Entscheidung in den USA&quot;,2020-11-07T19:20:56Z,UCeqKIgPQfNInOswGRWt48kQ,136162
Moment US TV networks declared Joe Biden as the next President of the United States,2020-11-07T19:24:31Z,UCPgLNge0xqQHWM5B5EFH9Cg,355137
Joe Biden es el nuevo presidente de Estados Unidos,2020-11-07T19:26:45Z,UCT7KFGv6s2a-rh2Jq8ZdM1g,135918
Trump supporters in Arizona in disbelief over Biden win,2020-11-07T19:48:48Z,UCuFFtHWoLl5fauMMD5Ww2jA,1152189
Andrew Yang on Joe Biden Winning the Presidency,2020-11-07T21:22:00Z,UCQFT4LWtQY67xyhDAChiqcw,53957
"La riposte du camp Trump après la victoire de Joe Biden, élu président des États-Unis",2020-11-07T21:22:08Z,UCCCPCZNChQdGa9EkATeye4g,379167
Joe Biden gewinnt US-Präsidentschaftswahl gegen Donald Trump | US-Wahl 2020,2020-11-07T22:23:13Z,UCMIgOXM2JEQ2Pv2d0_PVfcg,154000
Vitória de Biden: Trump emite comunicado dizendo que resultados serão contestados na Justiça,2020-11-07T23:00:29Z,UCoa-D_VfMkFrCYodrOC9-mA,158291
"Com vitória de Biden, política externa do Brasil deve mudar",2020-11-07T23:05:05Z,UCoa-D_VfMkFrCYodrOC9-mA,407819
"How Donald Trump, White House reacted to Joe Biden&#39;s projected election victory",2020-11-08T00:34:15Z,UCrp_UI8XtuYfpiqluWLD7Lw,7740482
ENDLICH PRÄSIDENT: TV-Sender rufen Wahlsieg von Joe Biden aus - Trump will klagen,2020-11-08T00:38:08Z,UCZMsvbAhhRblVGXmEXW8TSA,1877434
Ông Biden đắc cử Tổng thống? Ông Trump nói &quot;còn lâu...&quot; | VTV24,2020-11-08T00:44:00Z,UCabsTV34JwALXKGMqHpvUiA,348028
"Siapa Joe Biden, calon presiden AS yang kalahkan Donald Trump di Pemilu 2020? - BBC News Indonesia",2020-11-08T01:04:06Z,UC46q-QSvoJz-1iSxPeuOqWA,656154
World leaders congratulate Joe Biden on his projected election win,2020-11-08T01:19:47Z,UCrp_UI8XtuYfpiqluWLD7Lw,73850
Joe Biden Menang Pilpres Amerika 2020 Kalahkan Donald Trump,2020-11-08T01:41:22Z,UC5BMIWZe9isJXLZZWPWvBlg,169883
Joe Biden Delivers First Speech as President-Elect | NBC New York,2020-11-08T01:59:31Z,UCxCfoSInadl-4i3F70zDt1A,287397
