title,upload_time,uploader,view_count
Trump a la cabeza demanda federal eliminara 792 mil votos de Biden,2020-11-15T23:20:10Z,UCr9xpZl2qNsZiv2acatQVvg,86291
Biden to announce his transition team,2020-11-16T02:05:47Z,UCAeWdyKJXGWmVAXFpgLNNTg,29790
GOP To Biden: No Progressives Allowed,2020-11-16T04:00:01Z,UC1yBKRuGpC1tSM73A0ZjYjQ,101821
"Trump: Biden Kazandı, Çünkü Seçim Hileli",2020-11-16T07:30:01Z,UCzgrZ-CndOoylh2_e72nSBQ,10226
US-WAHL 2020: TRUMP kündigt weitere Klagen an - BIDEN will Trump-Beschlüsse revidieren,2020-11-16T08:30:00Z,UCZMsvbAhhRblVGXmEXW8TSA,54389
NYC Mayor’s Daughter Says the Quiet Part OUT LOUD about Joe Biden’s “Victory”,2020-11-16T12:00:00Z,UCLoNQH9RCndfUGOb2f7E1Ew,179703
Biden Moves Ahead With Plans As Trump Still Refuses To Concede | TODAY,2020-11-16T13:30:02Z,UChDKyKQ59fYz3JO2fl0Z6sg,213894
"Meet Ron Klain, Joe Biden&#39;s Chief of Staff Pick | NowThis",2020-11-16T13:59:48Z,UCn4sPeUomNGIr26bElVdDYg,16344
Joe Biden’s Path to the Presidency | The Daily Show,2020-11-16T14:00:03Z,UCwWhs_6x42TyRM4Wstoq8HA,402986
President Trump blocks President-elect Biden’s team from White House COVID-19 task force,2020-11-16T14:04:27Z,UC-SJ6nODDmufqBzPBwCvYvQ,233914
"Joe Biden élu aux États-Unis, et maintenant ?",2020-11-16T14:32:12Z,UCCCPCZNChQdGa9EkATeye4g,24976
President-elect Biden preparing for first days in office despite Trump denials,2020-11-16T14:39:16Z,UC8p1vwvWtl6T73JiExfWs1g,282775
LIVE: President-elect Joe Biden delivers a speech on building the economy,2020-11-16T14:53:13Z,UCEAZeUIeJs0IjQiqTCdVSIg,6232
Watch live: Joe Biden and Kamala Harris deliver remarks on the economy in Delaware,2020-11-16T15:16:57Z,UC8p1vwvWtl6T73JiExfWs1g,4880
Watch live: Joe Biden and Kamala Harris deliver remarks on the economy in Delaware,2020-11-16T15:16:57Z,UC8p1vwvWtl6T73JiExfWs1g,4880
"LIVE: Biden, Harris deliver remarks on economic recovery",2020-11-16T16:41:46Z,UCCXoCcu9Rp7NPbTzIvogpZg,10163
WATCH LIVE: President-elect Biden and VP-elect Harris speak on economic recovery — 11/16/2020,2020-11-16T17:04:27Z,UCrp_UI8XtuYfpiqluWLD7Lw,2582
"President Trump refuses to concede, delaying resources for Biden transition",2020-11-16T17:36:54Z,UC8p1vwvWtl6T73JiExfWs1g,13410
EN VIVO: Declaraciones de Joe Biden sobre sus planes para la recuperación de la economía,2020-11-16T17:55:01Z,UCRwA1NUcUnwsly35ikGhp0A,8757
Live: President-elect Joe Biden gives speech on rebuilding the economy,2020-11-16T18:11:51Z,UCshwRhftzkiov5wKR7M_LsQ,2104
WATCH: Biden delivers remarks on reviving U.S. economy,2020-11-16T18:21:19Z,UCHd62-u_v4DvJ8TCFtpi4GA,12230
WATCH LIVE: Biden speaks after briefing on economy,2020-11-16T18:29:32Z,UC6ZFN9Tx6xh-skXCuRHCDpQ,11052
Remarks by President-elect Joe Biden and Vice President-elect Kamala Harris on the Economy,2020-11-16T18:40:14Z,UCWNpXitY8eJ-ku6M-v25MKw,16385
Who&#39;s in the running for Biden&#39;s cabinet?,2020-11-16T18:58:13Z,UCHd62-u_v4DvJ8TCFtpi4GA,9968
